{
  "$schema": "http://json-schema.org/draft-07/schema#",
  "type": [
    "object",
    "null"
  ],
  "properties": {
    "timestamp": {
      "type": "string"
    },
    "serialNumber": {
      "type": "string"
    },
    "calibrating": {
      "type": "boolean"
    },
    "references": {
      "type": "array",
      "items": {
        "type": "object",
        "properties": {
          "referenceKey": {
            "type": "string"
          },
          "referenceValue": {
            "type": "integer"
          }
        },
        "required": [
          "referenceKey",
          "referenceValue"
        ]
      }
    },
    "status_references": {
      "type": "array",
      "items": {
        "type": "object",
        "properties": {
          "referenceKey": {
            "type": "string"
          },
          "referenceValue": {
            "type": "string"
          }
        },
        "required": [
          "referenceKey",
          "referenceValue"
        ]
      }
    }
  },
  "required": [
    "calibrating",
    "serialNumber",
    "timestamp"
  ],
  "title": "Ccu_State_Calibration_Serial Schema",
  "description": "Granular schema for ccu_state_calibration_serial topics from 15 examples",
  "category": "ccu",
  "additionalProperties": true
}